{
  "appVersion" : "2.4.0",
  "kitVersion" : "1.1.0",
  "algorithmVersion" : "1.1.2",
  "schemaVersion" : "1.0",
  "depthTier" : "A",
  "depthSource" : "LIDAR",
  "device" : {
    "model" : "iPhone15,3",
    "os" : "iOS 18.2"
  },
  "sessionId" : "b1d0a2c4-5e6f-4a7b-8c9d-0e1f2a3b4c5d",
  "worldOriginEpoch" : 2147483647
}
